GEO.id,GEO.id2,GEO.display-label,HD01_VD01,HD02_VD01,HD01_VD02,HD02_VD02,HD01_VD03,HD02_VD03,HD01_VD04,HD02_VD04,HD01_VD05,HD02_VD05,HD01_VD06,HD02_VD06,HD01_VD07,HD02_VD07,HD01_VD08,HD02_VD08,HD01_VD09,HD02_VD09,HD01_VD10,HD02_VD10,HD01_VD11,HD02_VD11,HD01_VD12,HD02_VD12,HD01_VD13,HD02_VD13,HD01_VD14,HD02_VD14,HD01_VD15,HD02_VD15,HD01_VD16,HD02_VD16,HD01_VD17,HD02_VD17,HD01_VD18,HD02_VD18,HD01_VD19,HD02_VD19,HD01_VD20,HD02_VD20,HD01_VD21,HD02_VD21,HD01_VD22,HD02_VD22,HD01_VD23,HD02_VD23,HD01_VD24,HD02_VD24,HD01_VD25,HD02_VD25,HD01_VD26,HD02_VD26,HD01_VD27,HD02_VD27,HD01_VD28,HD02_VD28,HD01_VD29,HD02_VD29,HD01_VD30,HD02_VD30,HD01_VD31,HD02_VD31,HD01_VD32,HD02_VD32,HD01_VD33,HD02_VD33,HD01_VD34,HD02_VD34,HD01_VD35,HD02_VD35,HD01_VD36,HD02_VD36,HD01_VD37,HD02_VD37,HD01_VD38,HD02_VD38,HD01_VD39,HD02_VD39,HD01_VD40,HD02_VD40,HD01_VD41,HD02_VD41
Id,Id2,Geography,Estimate; Total:,Margin of Error; Total:,Estimate; Income in the past 12 months below poverty level:,Margin of Error; Income in the past 12 months below poverty level:,Estimate; Income in the past 12 months below poverty level: - Married-couple family:,Margin of Error; Income in the past 12 months below poverty level: - Married-couple family:,Estimate; Income in the past 12 months below poverty level: - Married-couple family: - With related children under 18 years:,Margin of Error; Income in the past 12 months below poverty level: - Married-couple family: - With related children under 18 years:,Estimate; Income in the past 12 months below poverty level: - Married-couple family: - With related children under 18 years: - Under 5 years only,Margin of Error; Income in the past 12 months below poverty level: - Married-couple family: - With related children under 18 years: - Under 5 years only,Estimate; Income in the past 12 months below poverty level: - Married-couple family: - With related children under 18 years: - Under 5 years and 5 to 17 years,Margin of Error; Income in the past 12 months below poverty level: - Married-couple family: - With related children under 18 years: - Under 5 years and 5 to 17 years,Estimate; Income in the past 12 months below poverty level: - Married-couple family: - With related children under 18 years: - 5 to 17 years only,Margin of Error; Income in the past 12 months below poverty level: - Married-couple family: - With related children under 18 years: - 5 to 17 years only,Estimate; Income in the past 12 months below poverty level: - Married-couple family: - No related children under 18 years,Margin of Error; Income in the past 12 months below poverty level: - Married-couple family: - No related children under 18 years,Estimate; Income in the past 12 months below poverty level: - Other family:,Margin of Error; Income in the past 12 months below poverty level: - Other family:,"Estimate; Income in the past 12 months below poverty level: - Other family: - Male householder, no wife present:","Margin of Error; Income in the past 12 months below poverty level: - Other family: - Male householder, no wife present:","Estimate; Income in the past 12 months below poverty level: - Other family: - Male householder, no wife present: - With related children under 18 years:","Margin of Error; Income in the past 12 months below poverty level: - Other family: - Male householder, no wife present: - With related children under 18 years:","Estimate; Income in the past 12 months below poverty level: - Other family: - Male householder, no wife present: - With related children under 18 years: - Under 5 years only","Margin of Error; Income in the past 12 months below poverty level: - Other family: - Male householder, no wife present: - With related children under 18 years: - Under 5 years only","Estimate; Income in the past 12 months below poverty level: - Other family: - Male householder, no wife present: - With related children under 18 years: - Under 5 years and 5 to 17 years","Margin of Error; Income in the past 12 months below poverty level: - Other family: - Male householder, no wife present: - With related children under 18 years: - Under 5 years and 5 to 17 years","Estimate; Income in the past 12 months below poverty level: - Other family: - Male householder, no wife present: - With related children under 18 years: - 5 to 17 years only","Margin of Error; Income in the past 12 months below poverty level: - Other family: - Male householder, no wife present: - With related children under 18 years: - 5 to 17 years only","Estimate; Income in the past 12 months below poverty level: - Other family: - Male householder, no wife present: - No related children under 18 years","Margin of Error; Income in the past 12 months below poverty level: - Other family: - Male householder, no wife present: - No related children under 18 years","Estimate; Income in the past 12 months below poverty level: - Other family: - Female householder, no husband present:","Margin of Error; Income in the past 12 months below poverty level: - Other family: - Female householder, no husband present:","Estimate; Income in the past 12 months below poverty level: - Other family: - Female householder, no husband present: - With related children under 18 years:","Margin of Error; Income in the past 12 months below poverty level: - Other family: - Female householder, no husband present: - With related children under 18 years:","Estimate; Income in the past 12 months below poverty level: - Other family: - Female householder, no husband present: - With related children under 18 years: - Under 5 years only","Margin of Error; Income in the past 12 months below poverty level: - Other family: - Female householder, no husband present: - With related children under 18 years: - Under 5 years only","Estimate; Income in the past 12 months below poverty level: - Other family: - Female householder, no husband present: - With related children under 18 years: - Under 5 years and 5 to 17 years","Margin of Error; Income in the past 12 months below poverty level: - Other family: - Female householder, no husband present: - With related children under 18 years: - Under 5 years and 5 to 17 years","Estimate; Income in the past 12 months below poverty level: - Other family: - Female householder, no husband present: - With related children under 18 years: - 5 to 17 years only","Margin of Error; Income in the past 12 months below poverty level: - Other family: - Female householder, no husband present: - With related children under 18 years: - 5 to 17 years only","Estimate; Income in the past 12 months below poverty level: - Other family: - Female householder, no husband present: - No related children under 18 years","Margin of Error; Income in the past 12 months below poverty level: - Other family: - Female householder, no husband present: - No related children under 18 years",Estimate; Income in the past 12 months at or above poverty level:,Margin of Error; Income in the past 12 months at or above poverty level:,Estimate; Income in the past 12 months at or above poverty level: - Married-couple family:,Margin of Error; Income in the past 12 months at or above poverty level: - Married-couple family:,Estimate; Income in the past 12 months at or above poverty level: - Married-couple family: - With related children under 18 years:,Margin of Error; Income in the past 12 months at or above poverty level: - Married-couple family: - With related children under 18 years:,Estimate; Income in the past 12 months at or above poverty level: - Married-couple family: - With related children under 18 years: - Under 5 years only,Margin of Error; Income in the past 12 months at or above poverty level: - Married-couple family: - With related children under 18 years: - Under 5 years only,Estimate; Income in the past 12 months at or above poverty level: - Married-couple family: - With related children under 18 years: - Under 5 years and 5 to 17 years,Margin of Error; Income in the past 12 months at or above poverty level: - Married-couple family: - With related children under 18 years: - Under 5 years and 5 to 17 years,Estimate; Income in the past 12 months at or above poverty level: - Married-couple family: - With related children under 18 years: - 5 to 17 years only,Margin of Error; Income in the past 12 months at or above poverty level: - Married-couple family: - With related children under 18 years: - 5 to 17 years only,Estimate; Income in the past 12 months at or above poverty level: - Married-couple family: - No related children under 18 years,Margin of Error; Income in the past 12 months at or above poverty level: - Married-couple family: - No related children under 18 years,Estimate; Income in the past 12 months at or above poverty level: - Other family:,Margin of Error; Income in the past 12 months at or above poverty level: - Other family:,"Estimate; Income in the past 12 months at or above poverty level: - Other family: - Male householder, no wife present:","Margin of Error; Income in the past 12 months at or above poverty level: - Other family: - Male householder, no wife present:","Estimate; Income in the past 12 months at or above poverty level: - Other family: - Male householder, no wife present: - With related children under 18 years:","Margin of Error; Income in the past 12 months at or above poverty level: - Other family: - Male householder, no wife present: - With related children under 18 years:","Estimate; Income in the past 12 months at or above poverty level: - Other family: - Male householder, no wife present: - With related children under 18 years: - Under 5 years only","Margin of Error; Income in the past 12 months at or above poverty level: - Other family: - Male householder, no wife present: - With related children under 18 years: - Under 5 years only","Estimate; Income in the past 12 months at or above poverty level: - Other family: - Male householder, no wife present: - With related children under 18 years: - Under 5 years and 5 to 17 years","Margin of Error; Income in the past 12 months at or above poverty level: - Other family: - Male householder, no wife present: - With related children under 18 years: - Under 5 years and 5 to 17 years","Estimate; Income in the past 12 months at or above poverty level: - Other family: - Male householder, no wife present: - With related children under 18 years: - 5 to 17 years only","Margin of Error; Income in the past 12 months at or above poverty level: - Other family: - Male householder, no wife present: - With related children under 18 years: - 5 to 17 years only","Estimate; Income in the past 12 months at or above poverty level: - Other family: - Male householder, no wife present: - No related children under 18 years","Margin of Error; Income in the past 12 months at or above poverty level: - Other family: - Male householder, no wife present: - No related children under 18 years","Estimate; Income in the past 12 months at or above poverty level: - Other family: - Female householder, no husband present:","Margin of Error; Income in the past 12 months at or above poverty level: - Other family: - Female householder, no husband present:","Estimate; Income in the past 12 months at or above poverty level: - Other family: - Female householder, no husband present: - With related children under 18 years:","Margin of Error; Income in the past 12 months at or above poverty level: - Other family: - Female householder, no husband present: - With related children under 18 years:","Estimate; Income in the past 12 months at or above poverty level: - Other family: - Female householder, no husband present: - With related children under 18 years: - Under 5 years only","Margin of Error; Income in the past 12 months at or above poverty level: - Other family: - Female householder, no husband present: - With related children under 18 years: - Under 5 years only","Estimate; Income in the past 12 months at or above poverty level: - Other family: - Female householder, no husband present: - With related children under 18 years: - Under 5 years and 5 to 17 years","Margin of Error; Income in the past 12 months at or above poverty level: - Other family: - Female householder, no husband present: - With related children under 18 years: - Under 5 years and 5 to 17 years","Estimate; Income in the past 12 months at or above poverty level: - Other family: - Female householder, no husband present: - With related children under 18 years: - 5 to 17 years only","Margin of Error; Income in the past 12 months at or above poverty level: - Other family: - Female householder, no husband present: - With related children under 18 years: - 5 to 17 years only","Estimate; Income in the past 12 months at or above poverty level: - Other family: - Female householder, no husband present: - No related children under 18 years","Margin of Error; Income in the past 12 months at or above poverty level: - Other family: - Female householder, no husband present: - No related children under 18 years"
0100000US,,United States,51939578,75008,3834680,30844,1604866,18971,851594,12771,155824,5381,268753,7538,427017,9344,753272,14317,2229814,22943,419500,10878,304644,9217,80269,4476,48919,3579,175456,6787,114856,5202,1810314,19970,1521923,16943,358696,9798,329637,9552,833590,13172,288391,8866,48104898,81752,39824301,97052,14848618,55846,2872415,28455,2604010,24907,9372193,39689,24975683,67890,8280597,43387,2698689,28602,1388992,18966,286446,8295,135254,6074,967292,15820,1309697,17793,5581908,34004,2928873,24818,439465,10033,300469,9869,2188939,21641,2653035,23579
0400000US37,37,North Carolina,1712584,12509,142327,6170,63540,3955,36372,2786,7162,1385,10759,1376,18451,2189,27168,2535,78787,4897,14118,2263,9633,1737,1641,582,1847,589,6145,1460,4485,1117,64669,4230,54325,4091,13520,2092,10237,1572,30568,3071,10344,1487,1570257,11226,1326273,10833,492141,8310,97607,4783,80377,3922,314157,6021,834132,8819,243984,7879,81004,4320,43800,3858,8718,1584,3774,1084,31308,3209,37204,2696,162980,6450,89679,5068,14310,1862,10386,1732,64983,4401,73301,3578
0500000US37063,37063,"Durham County, North Carolina",31434,1554,1892,683,924,414,555,326,250,201,72,121,233,236,369,278,968,549,228,199,228,199,228,199,0,193,0,193,0,193,740,477,477,407,121,136,0,193,356,385,263,212,29542,1456,26080,1686,9264,1315,3127,759,994,435,5143,1021,16816,1661,3462,1060,1388,558,602,452,77,129,95,154,430,417,786,377,2074,827,1378,679,0,193,119,142,1259,667,696,432
0500000US37067,37067,"Forsyth County, North Carolina",56451,2056,3656,964,1692,686,1345,631,145,198,521,435,679,442,347,210,1964,668,186,130,152,115,0,193,31,52,121,116,34,58,1778,613,1322,530,175,179,471,311,676,354,456,304,52795,1876,45167,1896,15884,1484,3411,747,2339,669,10134,1193,29283,1671,7628,1238,2528,754,1716,634,249,270,420,401,1047,494,812,403,5100,1021,2696,703,446,281,234,137,2016,567,2404,710
0500000US37081,37081,"Guilford County, North Carolina",71672,2097,3413,865,1667,552,1061,470,177,180,391,246,493,355,606,299,1746,648,341,372,316,370,0,193,57,96,259,356,25,43,1405,500,1133,464,396,328,169,219,568,297,272,209,68259,2247,56674,2355,19743,1787,4213,973,3269,842,12261,1240,36931,1921,11585,1709,3501,889,1697,567,227,188,369,395,1101,527,1804,725,8084,1513,4234,1170,414,239,320,356,3500,1074,3850,977
