GEO.id,GEO.id2,GEO.display-label,HD01_VD01,HD02_VD01,HD01_VD02,HD02_VD02,HD01_VD03,HD02_VD03,HD01_VD04,HD02_VD04,HD01_VD05,HD02_VD05,HD01_VD06,HD02_VD06,HD01_VD07,HD02_VD07,HD01_VD08,HD02_VD08,HD01_VD09,HD02_VD09,HD01_VD10,HD02_VD10,HD01_VD11,HD02_VD11,HD01_VD12,HD02_VD12,HD01_VD13,HD02_VD13,HD01_VD14,HD02_VD14,HD01_VD15,HD02_VD15,HD01_VD16,HD02_VD16,HD01_VD17,HD02_VD17,HD01_VD18,HD02_VD18,HD01_VD19,HD02_VD19,HD01_VD20,HD02_VD20,HD01_VD21,HD02_VD21,HD01_VD22,HD02_VD22,HD01_VD23,HD02_VD23,HD01_VD24,HD02_VD24,HD01_VD25,HD02_VD25,HD01_VD26,HD02_VD26,HD01_VD27,HD02_VD27,HD01_VD28,HD02_VD28,HD01_VD29,HD02_VD29,HD01_VD30,HD02_VD30,HD01_VD31,HD02_VD31,HD01_VD32,HD02_VD32,HD01_VD33,HD02_VD33,HD01_VD34,HD02_VD34,HD01_VD35,HD02_VD35,HD01_VD36,HD02_VD36,HD01_VD37,HD02_VD37,HD01_VD38,HD02_VD38,HD01_VD39,HD02_VD39,HD01_VD40,HD02_VD40,HD01_VD41,HD02_VD41
Id,Id2,Geography,Estimate; Total:,Margin of Error; Total:,Estimate; Income in the past 12 months below poverty level:,Margin of Error; Income in the past 12 months below poverty level:,Estimate; Income in the past 12 months below poverty level: - Married-couple family:,Margin of Error; Income in the past 12 months below poverty level: - Married-couple family:,Estimate; Income in the past 12 months below poverty level: - Married-couple family: - With related children under 18 years:,Margin of Error; Income in the past 12 months below poverty level: - Married-couple family: - With related children under 18 years:,Estimate; Income in the past 12 months below poverty level: - Married-couple family: - With related children under 18 years: - Under 5 years only,Margin of Error; Income in the past 12 months below poverty level: - Married-couple family: - With related children under 18 years: - Under 5 years only,Estimate; Income in the past 12 months below poverty level: - Married-couple family: - With related children under 18 years: - Under 5 years and 5 to 17 years,Margin of Error; Income in the past 12 months below poverty level: - Married-couple family: - With related children under 18 years: - Under 5 years and 5 to 17 years,Estimate; Income in the past 12 months below poverty level: - Married-couple family: - With related children under 18 years: - 5 to 17 years only,Margin of Error; Income in the past 12 months below poverty level: - Married-couple family: - With related children under 18 years: - 5 to 17 years only,Estimate; Income in the past 12 months below poverty level: - Married-couple family: - No related children under 18 years,Margin of Error; Income in the past 12 months below poverty level: - Married-couple family: - No related children under 18 years,Estimate; Income in the past 12 months below poverty level: - Other family:,Margin of Error; Income in the past 12 months below poverty level: - Other family:,"Estimate; Income in the past 12 months below poverty level: - Other family: - Male householder, no wife present:","Margin of Error; Income in the past 12 months below poverty level: - Other family: - Male householder, no wife present:","Estimate; Income in the past 12 months below poverty level: - Other family: - Male householder, no wife present: - With related children under 18 years:","Margin of Error; Income in the past 12 months below poverty level: - Other family: - Male householder, no wife present: - With related children under 18 years:","Estimate; Income in the past 12 months below poverty level: - Other family: - Male householder, no wife present: - With related children under 18 years: - Under 5 years only","Margin of Error; Income in the past 12 months below poverty level: - Other family: - Male householder, no wife present: - With related children under 18 years: - Under 5 years only","Estimate; Income in the past 12 months below poverty level: - Other family: - Male householder, no wife present: - With related children under 18 years: - Under 5 years and 5 to 17 years","Margin of Error; Income in the past 12 months below poverty level: - Other family: - Male householder, no wife present: - With related children under 18 years: - Under 5 years and 5 to 17 years","Estimate; Income in the past 12 months below poverty level: - Other family: - Male householder, no wife present: - With related children under 18 years: - 5 to 17 years only","Margin of Error; Income in the past 12 months below poverty level: - Other family: - Male householder, no wife present: - With related children under 18 years: - 5 to 17 years only","Estimate; Income in the past 12 months below poverty level: - Other family: - Male householder, no wife present: - No related children under 18 years","Margin of Error; Income in the past 12 months below poverty level: - Other family: - Male householder, no wife present: - No related children under 18 years","Estimate; Income in the past 12 months below poverty level: - Other family: - Female householder, no husband present:","Margin of Error; Income in the past 12 months below poverty level: - Other family: - Female householder, no husband present:","Estimate; Income in the past 12 months below poverty level: - Other family: - Female householder, no husband present: - With related children under 18 years:","Margin of Error; Income in the past 12 months below poverty level: - Other family: - Female householder, no husband present: - With related children under 18 years:","Estimate; Income in the past 12 months below poverty level: - Other family: - Female householder, no husband present: - With related children under 18 years: - Under 5 years only","Margin of Error; Income in the past 12 months below poverty level: - Other family: - Female householder, no husband present: - With related children under 18 years: - Under 5 years only","Estimate; Income in the past 12 months below poverty level: - Other family: - Female householder, no husband present: - With related children under 18 years: - Under 5 years and 5 to 17 years","Margin of Error; Income in the past 12 months below poverty level: - Other family: - Female householder, no husband present: - With related children under 18 years: - Under 5 years and 5 to 17 years","Estimate; Income in the past 12 months below poverty level: - Other family: - Female householder, no husband present: - With related children under 18 years: - 5 to 17 years only","Margin of Error; Income in the past 12 months below poverty level: - Other family: - Female householder, no husband present: - With related children under 18 years: - 5 to 17 years only","Estimate; Income in the past 12 months below poverty level: - Other family: - Female householder, no husband present: - No related children under 18 years","Margin of Error; Income in the past 12 months below poverty level: - Other family: - Female householder, no husband present: - No related children under 18 years",Estimate; Income in the past 12 months at or above poverty level:,Margin of Error; Income in the past 12 months at or above poverty level:,Estimate; Income in the past 12 months at or above poverty level: - Married-couple family:,Margin of Error; Income in the past 12 months at or above poverty level: - Married-couple family:,Estimate; Income in the past 12 months at or above poverty level: - Married-couple family: - With related children under 18 years:,Margin of Error; Income in the past 12 months at or above poverty level: - Married-couple family: - With related children under 18 years:,Estimate; Income in the past 12 months at or above poverty level: - Married-couple family: - With related children under 18 years: - Under 5 years only,Margin of Error; Income in the past 12 months at or above poverty level: - Married-couple family: - With related children under 18 years: - Under 5 years only,Estimate; Income in the past 12 months at or above poverty level: - Married-couple family: - With related children under 18 years: - Under 5 years and 5 to 17 years,Margin of Error; Income in the past 12 months at or above poverty level: - Married-couple family: - With related children under 18 years: - Under 5 years and 5 to 17 years,Estimate; Income in the past 12 months at or above poverty level: - Married-couple family: - With related children under 18 years: - 5 to 17 years only,Margin of Error; Income in the past 12 months at or above poverty level: - Married-couple family: - With related children under 18 years: - 5 to 17 years only,Estimate; Income in the past 12 months at or above poverty level: - Married-couple family: - No related children under 18 years,Margin of Error; Income in the past 12 months at or above poverty level: - Married-couple family: - No related children under 18 years,Estimate; Income in the past 12 months at or above poverty level: - Other family:,Margin of Error; Income in the past 12 months at or above poverty level: - Other family:,"Estimate; Income in the past 12 months at or above poverty level: - Other family: - Male householder, no wife present:","Margin of Error; Income in the past 12 months at or above poverty level: - Other family: - Male householder, no wife present:","Estimate; Income in the past 12 months at or above poverty level: - Other family: - Male householder, no wife present: - With related children under 18 years:","Margin of Error; Income in the past 12 months at or above poverty level: - Other family: - Male householder, no wife present: - With related children under 18 years:","Estimate; Income in the past 12 months at or above poverty level: - Other family: - Male householder, no wife present: - With related children under 18 years: - Under 5 years only","Margin of Error; Income in the past 12 months at or above poverty level: - Other family: - Male householder, no wife present: - With related children under 18 years: - Under 5 years only","Estimate; Income in the past 12 months at or above poverty level: - Other family: - Male householder, no wife present: - With related children under 18 years: - Under 5 years and 5 to 17 years","Margin of Error; Income in the past 12 months at or above poverty level: - Other family: - Male householder, no wife present: - With related children under 18 years: - Under 5 years and 5 to 17 years","Estimate; Income in the past 12 months at or above poverty level: - Other family: - Male householder, no wife present: - With related children under 18 years: - 5 to 17 years only","Margin of Error; Income in the past 12 months at or above poverty level: - Other family: - Male householder, no wife present: - With related children under 18 years: - 5 to 17 years only","Estimate; Income in the past 12 months at or above poverty level: - Other family: - Male householder, no wife present: - No related children under 18 years","Margin of Error; Income in the past 12 months at or above poverty level: - Other family: - Male householder, no wife present: - No related children under 18 years","Estimate; Income in the past 12 months at or above poverty level: - Other family: - Female householder, no husband present:","Margin of Error; Income in the past 12 months at or above poverty level: - Other family: - Female householder, no husband present:","Estimate; Income in the past 12 months at or above poverty level: - Other family: - Female householder, no husband present: - With related children under 18 years:","Margin of Error; Income in the past 12 months at or above poverty level: - Other family: - Female householder, no husband present: - With related children under 18 years:","Estimate; Income in the past 12 months at or above poverty level: - Other family: - Female householder, no husband present: - With related children under 18 years: - Under 5 years only","Margin of Error; Income in the past 12 months at or above poverty level: - Other family: - Female householder, no husband present: - With related children under 18 years: - Under 5 years only","Estimate; Income in the past 12 months at or above poverty level: - Other family: - Female householder, no husband present: - With related children under 18 years: - Under 5 years and 5 to 17 years","Margin of Error; Income in the past 12 months at or above poverty level: - Other family: - Female householder, no husband present: - With related children under 18 years: - Under 5 years and 5 to 17 years","Estimate; Income in the past 12 months at or above poverty level: - Other family: - Female householder, no husband present: - With related children under 18 years: - 5 to 17 years only","Margin of Error; Income in the past 12 months at or above poverty level: - Other family: - Female householder, no husband present: - With related children under 18 years: - 5 to 17 years only","Estimate; Income in the past 12 months at or above poverty level: - Other family: - Female householder, no husband present: - No related children under 18 years","Margin of Error; Income in the past 12 months at or above poverty level: - Other family: - Female householder, no husband present: - No related children under 18 years"
0100000US,,United States,76509262,122329,9054116,45181,3246140,28221,2077791,20552,319068,9459,750083,12088,1008640,14361,1168349,19141,5807976,35166,985398,17926,746822,15307,183139,6618,174025,6877,389658,10726,238576,8322,4822578,29284,4146048,26678,825191,15567,1130790,17569,2190067,21143,676530,11632,67455146,125711,52508310,144241,21868800,76753,4143959,34850,4161052,36667,13563789,56806,30639510,96407,14946836,61435,4592814,39257,2398932,26692,522902,11617,316147,10278,1559883,21466,2193882,24814,10354022,45529,5840593,33253,895281,15186,772519,14785,4172793,30013,4513429,31518
0400000US37,37,North Carolina,2472230,16171,331842,8395,112264,5982,72900,4396,12300,1950,24586,2140,36014,3055,39364,3362,219578,7523,37600,3484,29476,3087,6610,1580,7818,1148,15048,2348,8124,1556,181978,6430,156784,6142,35311,3373,40713,2997,80760,4320,25194,2244,2140388,16167,1683668,14332,674452,10462,128846,5718,120493,5224,425113,8091,1009216,10302,456720,11370,133533,5611,69445,4343,15611,2253,9048,1656,44786,3491,64088,4154,323187,9856,187388,8009,28531,3212,24209,3077,134648,6648,135799,5178
0500000US37063,37063,"Durham County, North Carolina",68159,2941,9387,1481,2888,800,2311,748,300,220,1206,550,805,469,577,330,6499,1264,1042,558,987,552,604,450,252,251,131,224,55,91,5457,1070,4423,939,774,457,1543,728,2106,752,1034,501,58772,2645,42674,2723,17408,2064,5152,895,2303,698,9953,1561,25266,2381,16098,2008,5325,1122,2694,862,332,269,716,458,1646,700,2631,734,10773,1596,6481,1288,540,406,814,488,5127,1186,4292,999
0500000US37067,37067,"Forsyth County, North Carolina",90508,3204,14499,1877,4043,1068,3396,974,331,275,1391,596,1674,689,647,354,10456,1574,1627,632,1346,622,42,75,186,208,1118,644,281,273,8829,1383,7897,1299,1741,807,1916,803,4240,805,932,406,76009,2791,58357,2484,23142,2182,4936,1113,3801,817,14405,1632,35215,1819,17652,2210,5145,941,2718,790,722,428,541,427,1455,574,2427,797,12507,1921,7048,1359,857,529,955,547,5236,931,5459,1078
0500000US37081,37081,"Guilford County, North Carolina",128065,3385,17531,2031,4383,882,3204,852,405,341,1622,615,1177,513,1179,434,13148,1865,2119,817,1797,794,504,364,280,260,1013,600,322,195,11029,1643,8585,1446,1942,699,2310,832,4333,1086,2444,805,110534,3618,80567,3102,32713,2311,6715,1162,6557,1290,19441,1704,47854,2665,29967,2657,7378,1252,3784,1038,1095,824,535,471,2154,706,3594,997,22589,2331,14109,1871,1637,663,2193,946,10279,1672,8480,1448
