GEO.id,GEO.id2,GEO.display-label,HD01_VD01,HD02_VD01,HD01_VD02,HD02_VD02,HD01_VD03,HD02_VD03,HD01_VD04,HD02_VD04,HD01_VD05,HD02_VD05,HD01_VD06,HD02_VD06,HD01_VD07,HD02_VD07,HD01_VD08,HD02_VD08,HD01_VD09,HD02_VD09,HD01_VD10,HD02_VD10,HD01_VD11,HD02_VD11,HD01_VD12,HD02_VD12,HD01_VD13,HD02_VD13,HD01_VD14,HD02_VD14,HD01_VD15,HD02_VD15,HD01_VD16,HD02_VD16,HD01_VD17,HD02_VD17,HD01_VD18,HD02_VD18,HD01_VD19,HD02_VD19,HD01_VD20,HD02_VD20,HD01_VD21,HD02_VD21,HD01_VD22,HD02_VD22,HD01_VD23,HD02_VD23,HD01_VD24,HD02_VD24,HD01_VD25,HD02_VD25,HD01_VD26,HD02_VD26,HD01_VD27,HD02_VD27,HD01_VD28,HD02_VD28,HD01_VD29,HD02_VD29,HD01_VD30,HD02_VD30,HD01_VD31,HD02_VD31,HD01_VD32,HD02_VD32,HD01_VD33,HD02_VD33,HD01_VD34,HD02_VD34,HD01_VD35,HD02_VD35,HD01_VD36,HD02_VD36,HD01_VD37,HD02_VD37,HD01_VD38,HD02_VD38,HD01_VD39,HD02_VD39,HD01_VD40,HD02_VD40,HD01_VD41,HD02_VD41
Id,Id2,Geography,Estimate; Total:,Margin of Error; Total:,Estimate; Income in the past 12 months below poverty level:,Margin of Error; Income in the past 12 months below poverty level:,Estimate; Income in the past 12 months below poverty level: - Married-couple family:,Margin of Error; Income in the past 12 months below poverty level: - Married-couple family:,Estimate; Income in the past 12 months below poverty level: - Married-couple family: - With related children under 18 years:,Margin of Error; Income in the past 12 months below poverty level: - Married-couple family: - With related children under 18 years:,Estimate; Income in the past 12 months below poverty level: - Married-couple family: - With related children under 18 years: - Under 5 years only,Margin of Error; Income in the past 12 months below poverty level: - Married-couple family: - With related children under 18 years: - Under 5 years only,Estimate; Income in the past 12 months below poverty level: - Married-couple family: - With related children under 18 years: - Under 5 years and 5 to 17 years,Margin of Error; Income in the past 12 months below poverty level: - Married-couple family: - With related children under 18 years: - Under 5 years and 5 to 17 years,Estimate; Income in the past 12 months below poverty level: - Married-couple family: - With related children under 18 years: - 5 to 17 years only,Margin of Error; Income in the past 12 months below poverty level: - Married-couple family: - With related children under 18 years: - 5 to 17 years only,Estimate; Income in the past 12 months below poverty level: - Married-couple family: - No related children under 18 years,Margin of Error; Income in the past 12 months below poverty level: - Married-couple family: - No related children under 18 years,Estimate; Income in the past 12 months below poverty level: - Other family:,Margin of Error; Income in the past 12 months below poverty level: - Other family:,"Estimate; Income in the past 12 months below poverty level: - Other family: - Male householder, no wife present:","Margin of Error; Income in the past 12 months below poverty level: - Other family: - Male householder, no wife present:","Estimate; Income in the past 12 months below poverty level: - Other family: - Male householder, no wife present: - With related children under 18 years:","Margin of Error; Income in the past 12 months below poverty level: - Other family: - Male householder, no wife present: - With related children under 18 years:","Estimate; Income in the past 12 months below poverty level: - Other family: - Male householder, no wife present: - With related children under 18 years: - Under 5 years only","Margin of Error; Income in the past 12 months below poverty level: - Other family: - Male householder, no wife present: - With related children under 18 years: - Under 5 years only","Estimate; Income in the past 12 months below poverty level: - Other family: - Male householder, no wife present: - With related children under 18 years: - Under 5 years and 5 to 17 years","Margin of Error; Income in the past 12 months below poverty level: - Other family: - Male householder, no wife present: - With related children under 18 years: - Under 5 years and 5 to 17 years","Estimate; Income in the past 12 months below poverty level: - Other family: - Male householder, no wife present: - With related children under 18 years: - 5 to 17 years only","Margin of Error; Income in the past 12 months below poverty level: - Other family: - Male householder, no wife present: - With related children under 18 years: - 5 to 17 years only","Estimate; Income in the past 12 months below poverty level: - Other family: - Male householder, no wife present: - No related children under 18 years","Margin of Error; Income in the past 12 months below poverty level: - Other family: - Male householder, no wife present: - No related children under 18 years","Estimate; Income in the past 12 months below poverty level: - Other family: - Female householder, no husband present:","Margin of Error; Income in the past 12 months below poverty level: - Other family: - Female householder, no husband present:","Estimate; Income in the past 12 months below poverty level: - Other family: - Female householder, no husband present: - With related children under 18 years:","Margin of Error; Income in the past 12 months below poverty level: - Other family: - Female householder, no husband present: - With related children under 18 years:","Estimate; Income in the past 12 months below poverty level: - Other family: - Female householder, no husband present: - With related children under 18 years: - Under 5 years only","Margin of Error; Income in the past 12 months below poverty level: - Other family: - Female householder, no husband present: - With related children under 18 years: - Under 5 years only","Estimate; Income in the past 12 months below poverty level: - Other family: - Female householder, no husband present: - With related children under 18 years: - Under 5 years and 5 to 17 years","Margin of Error; Income in the past 12 months below poverty level: - Other family: - Female householder, no husband present: - With related children under 18 years: - Under 5 years and 5 to 17 years","Estimate; Income in the past 12 months below poverty level: - Other family: - Female householder, no husband present: - With related children under 18 years: - 5 to 17 years only","Margin of Error; Income in the past 12 months below poverty level: - Other family: - Female householder, no husband present: - With related children under 18 years: - 5 to 17 years only","Estimate; Income in the past 12 months below poverty level: - Other family: - Female householder, no husband present: - No related children under 18 years","Margin of Error; Income in the past 12 months below poverty level: - Other family: - Female householder, no husband present: - No related children under 18 years",Estimate; Income in the past 12 months at or above poverty level:,Margin of Error; Income in the past 12 months at or above poverty level:,Estimate; Income in the past 12 months at or above poverty level: - Married-couple family:,Margin of Error; Income in the past 12 months at or above poverty level: - Married-couple family:,Estimate; Income in the past 12 months at or above poverty level: - Married-couple family: - With related children under 18 years:,Margin of Error; Income in the past 12 months at or above poverty level: - Married-couple family: - With related children under 18 years:,Estimate; Income in the past 12 months at or above poverty level: - Married-couple family: - With related children under 18 years: - Under 5 years only,Margin of Error; Income in the past 12 months at or above poverty level: - Married-couple family: - With related children under 18 years: - Under 5 years only,Estimate; Income in the past 12 months at or above poverty level: - Married-couple family: - With related children under 18 years: - Under 5 years and 5 to 17 years,Margin of Error; Income in the past 12 months at or above poverty level: - Married-couple family: - With related children under 18 years: - Under 5 years and 5 to 17 years,Estimate; Income in the past 12 months at or above poverty level: - Married-couple family: - With related children under 18 years: - 5 to 17 years only,Margin of Error; Income in the past 12 months at or above poverty level: - Married-couple family: - With related children under 18 years: - 5 to 17 years only,Estimate; Income in the past 12 months at or above poverty level: - Married-couple family: - No related children under 18 years,Margin of Error; Income in the past 12 months at or above poverty level: - Married-couple family: - No related children under 18 years,Estimate; Income in the past 12 months at or above poverty level: - Other family:,Margin of Error; Income in the past 12 months at or above poverty level: - Other family:,"Estimate; Income in the past 12 months at or above poverty level: - Other family: - Male householder, no wife present:","Margin of Error; Income in the past 12 months at or above poverty level: - Other family: - Male householder, no wife present:","Estimate; Income in the past 12 months at or above poverty level: - Other family: - Male householder, no wife present: - With related children under 18 years:","Margin of Error; Income in the past 12 months at or above poverty level: - Other family: - Male householder, no wife present: - With related children under 18 years:","Estimate; Income in the past 12 months at or above poverty level: - Other family: - Male householder, no wife present: - With related children under 18 years: - Under 5 years only","Margin of Error; Income in the past 12 months at or above poverty level: - Other family: - Male householder, no wife present: - With related children under 18 years: - Under 5 years only","Estimate; Income in the past 12 months at or above poverty level: - Other family: - Male householder, no wife present: - With related children under 18 years: - Under 5 years and 5 to 17 years","Margin of Error; Income in the past 12 months at or above poverty level: - Other family: - Male householder, no wife present: - With related children under 18 years: - Under 5 years and 5 to 17 years","Estimate; Income in the past 12 months at or above poverty level: - Other family: - Male householder, no wife present: - With related children under 18 years: - 5 to 17 years only","Margin of Error; Income in the past 12 months at or above poverty level: - Other family: - Male householder, no wife present: - With related children under 18 years: - 5 to 17 years only","Estimate; Income in the past 12 months at or above poverty level: - Other family: - Male householder, no wife present: - No related children under 18 years","Margin of Error; Income in the past 12 months at or above poverty level: - Other family: - Male householder, no wife present: - No related children under 18 years","Estimate; Income in the past 12 months at or above poverty level: - Other family: - Female householder, no husband present:","Margin of Error; Income in the past 12 months at or above poverty level: - Other family: - Female householder, no husband present:","Estimate; Income in the past 12 months at or above poverty level: - Other family: - Female householder, no husband present: - With related children under 18 years:","Margin of Error; Income in the past 12 months at or above poverty level: - Other family: - Female householder, no husband present: - With related children under 18 years:","Estimate; Income in the past 12 months at or above poverty level: - Other family: - Female householder, no husband present: - With related children under 18 years: - Under 5 years only","Margin of Error; Income in the past 12 months at or above poverty level: - Other family: - Female householder, no husband present: - With related children under 18 years: - Under 5 years only","Estimate; Income in the past 12 months at or above poverty level: - Other family: - Female householder, no husband present: - With related children under 18 years: - Under 5 years and 5 to 17 years","Margin of Error; Income in the past 12 months at or above poverty level: - Other family: - Female householder, no husband present: - With related children under 18 years: - Under 5 years and 5 to 17 years","Estimate; Income in the past 12 months at or above poverty level: - Other family: - Female householder, no husband present: - With related children under 18 years: - 5 to 17 years only","Margin of Error; Income in the past 12 months at or above poverty level: - Other family: - Female householder, no husband present: - With related children under 18 years: - 5 to 17 years only","Estimate; Income in the past 12 months at or above poverty level: - Other family: - Female householder, no husband present: - No related children under 18 years","Margin of Error; Income in the past 12 months at or above poverty level: - Other family: - Female householder, no husband present: - No related children under 18 years"
0100000US,,United States,8453962,36944,1757441,20388,252865,9236,155452,7370,23733,2878,51853,4186,79866,5004,97413,4922,1504576,19587,168610,8628,125906,7407,31939,3565,27557,3638,66410,4383,42704,4154,1335966,17922,1178001,17441,223247,9498,358312,11172,596442,12545,157965,5943,6696521,34671,3507612,25511,1774845,19806,278256,8756,364142,9166,1132447,14151,1732767,22503,3188909,29049,632068,13413,350275,10833,79735,5701,47453,3585,223087,8442,281793,8594,2556841,27658,1693977,22638,248570,8734,270147,9748,1175260,20954,862864,14356
0400000US37,37,North Carolina,483118,7817,103083,5394,14404,1987,7325,1401,1029,653,2109,731,4187,1128,7079,1378,88679,5258,10009,2068,6785,1745,1055,571,2225,981,3505,1235,3224,1038,78670,4792,69303,4852,14700,2653,18755,2315,35848,3826,9367,1660,380035,8236,213859,7248,99853,5464,15942,2620,16847,2243,67064,4963,114006,5331,166176,5930,31464,3223,15942,2578,3231,1193,2072,845,10639,1980,15522,1961,134712,5510,90665,4834,14193,2102,13047,2362,63425,4210,44047,3446
0500000US37063,37063,"Durham County, North Carolina",24834,1938,3388,801,396,300,312,270,0,289,269,264,43,76,84,141,2992,865,582,370,243,234,117,150,63,107,63,111,339,353,2410,772,2055,706,562,424,324,389,1169,443,355,317,21446,1938,11295,1491,4926,1282,982,667,706,467,3238,1049,6369,1074,10151,1862,2298,898,1151,697,485,517,0,289,666,567,1147,483,7853,1599,5249,1405,217,214,818,538,4214,1216,2604,790
0500000US37067,37067,"Forsyth County, North Carolina",21370,1911,4545,1152,246,271,147,236,0,289,0,289,147,236,99,120,4299,1135,240,309,57,92,0,289,0,289,57,92,183,294,4059,1052,3299,964,1126,656,902,552,1271,591,760,450,16825,1832,10114,1362,5344,1189,723,487,829,524,3792,1128,4770,930,6711,1314,1235,655,653,493,240,298,0,289,413,389,582,439,5476,1115,3853,925,969,507,950,563,1934,617,1623,541
0500000US37081,37081,"Guilford County, North Carolina",34739,2197,5921,1328,813,346,403,239,0,289,236,204,167,144,410,260,5108,1256,399,296,399,296,295,261,0,289,104,132,0,289,4709,1159,4476,1108,1091,590,1330,582,2055,769,233,243,28818,2145,17266,1964,9577,1529,1013,511,1993,893,6571,1333,7689,1254,11552,1710,2281,902,1140,633,388,376,150,183,602,443,1141,532,9271,1565,5864,1084,773,485,1148,671,3943,864,3407,1011
