GEO.id,GEO.id2,GEO.display-label,HD01_VD01,HD02_VD01,HD01_VD02,HD02_VD02,HD01_VD03,HD02_VD03,HD01_VD04,HD02_VD04,HD01_VD05,HD02_VD05,HD01_VD06,HD02_VD06,HD01_VD07,HD02_VD07,HD01_VD08,HD02_VD08,HD01_VD09,HD02_VD09,HD01_VD10,HD02_VD10,HD01_VD11,HD02_VD11,HD01_VD12,HD02_VD12,HD01_VD13,HD02_VD13,HD01_VD14,HD02_VD14,HD01_VD15,HD02_VD15,HD01_VD16,HD02_VD16,HD01_VD17,HD02_VD17,HD01_VD18,HD02_VD18,HD01_VD19,HD02_VD19,HD01_VD20,HD02_VD20,HD01_VD21,HD02_VD21,HD01_VD22,HD02_VD22,HD01_VD23,HD02_VD23,HD01_VD24,HD02_VD24,HD01_VD25,HD02_VD25,HD01_VD26,HD02_VD26,HD01_VD27,HD02_VD27,HD01_VD28,HD02_VD28,HD01_VD29,HD02_VD29,HD01_VD30,HD02_VD30,HD01_VD31,HD02_VD31,HD01_VD32,HD02_VD32,HD01_VD33,HD02_VD33,HD01_VD34,HD02_VD34,HD01_VD35,HD02_VD35,HD01_VD36,HD02_VD36,HD01_VD37,HD02_VD37,HD01_VD38,HD02_VD38,HD01_VD39,HD02_VD39,HD01_VD40,HD02_VD40,HD01_VD41,HD02_VD41
Id,Id2,Geography,Estimate; Total:,Margin of Error; Total:,Estimate; Income in the past 12 months below poverty level:,Margin of Error; Income in the past 12 months below poverty level:,Estimate; Income in the past 12 months below poverty level: - Married-couple family:,Margin of Error; Income in the past 12 months below poverty level: - Married-couple family:,Estimate; Income in the past 12 months below poverty level: - Married-couple family: - With related children under 18 years:,Margin of Error; Income in the past 12 months below poverty level: - Married-couple family: - With related children under 18 years:,Estimate; Income in the past 12 months below poverty level: - Married-couple family: - With related children under 18 years: - Under 5 years only,Margin of Error; Income in the past 12 months below poverty level: - Married-couple family: - With related children under 18 years: - Under 5 years only,Estimate; Income in the past 12 months below poverty level: - Married-couple family: - With related children under 18 years: - Under 5 years and 5 to 17 years,Margin of Error; Income in the past 12 months below poverty level: - Married-couple family: - With related children under 18 years: - Under 5 years and 5 to 17 years,Estimate; Income in the past 12 months below poverty level: - Married-couple family: - With related children under 18 years: - 5 to 17 years only,Margin of Error; Income in the past 12 months below poverty level: - Married-couple family: - With related children under 18 years: - 5 to 17 years only,Estimate; Income in the past 12 months below poverty level: - Married-couple family: - No related children under 18 years,Margin of Error; Income in the past 12 months below poverty level: - Married-couple family: - No related children under 18 years,Estimate; Income in the past 12 months below poverty level: - Other family:,Margin of Error; Income in the past 12 months below poverty level: - Other family:,"Estimate; Income in the past 12 months below poverty level: - Other family: - Male householder, no wife present:","Margin of Error; Income in the past 12 months below poverty level: - Other family: - Male householder, no wife present:","Estimate; Income in the past 12 months below poverty level: - Other family: - Male householder, no wife present: - With related children under 18 years:","Margin of Error; Income in the past 12 months below poverty level: - Other family: - Male householder, no wife present: - With related children under 18 years:","Estimate; Income in the past 12 months below poverty level: - Other family: - Male householder, no wife present: - With related children under 18 years: - Under 5 years only","Margin of Error; Income in the past 12 months below poverty level: - Other family: - Male householder, no wife present: - With related children under 18 years: - Under 5 years only","Estimate; Income in the past 12 months below poverty level: - Other family: - Male householder, no wife present: - With related children under 18 years: - Under 5 years and 5 to 17 years","Margin of Error; Income in the past 12 months below poverty level: - Other family: - Male householder, no wife present: - With related children under 18 years: - Under 5 years and 5 to 17 years","Estimate; Income in the past 12 months below poverty level: - Other family: - Male householder, no wife present: - With related children under 18 years: - 5 to 17 years only","Margin of Error; Income in the past 12 months below poverty level: - Other family: - Male householder, no wife present: - With related children under 18 years: - 5 to 17 years only","Estimate; Income in the past 12 months below poverty level: - Other family: - Male householder, no wife present: - No related children under 18 years","Margin of Error; Income in the past 12 months below poverty level: - Other family: - Male householder, no wife present: - No related children under 18 years","Estimate; Income in the past 12 months below poverty level: - Other family: - Female householder, no husband present:","Margin of Error; Income in the past 12 months below poverty level: - Other family: - Female householder, no husband present:","Estimate; Income in the past 12 months below poverty level: - Other family: - Female householder, no husband present: - With related children under 18 years:","Margin of Error; Income in the past 12 months below poverty level: - Other family: - Female householder, no husband present: - With related children under 18 years:","Estimate; Income in the past 12 months below poverty level: - Other family: - Female householder, no husband present: - With related children under 18 years: - Under 5 years only","Margin of Error; Income in the past 12 months below poverty level: - Other family: - Female householder, no husband present: - With related children under 18 years: - Under 5 years only","Estimate; Income in the past 12 months below poverty level: - Other family: - Female householder, no husband present: - With related children under 18 years: - Under 5 years and 5 to 17 years","Margin of Error; Income in the past 12 months below poverty level: - Other family: - Female householder, no husband present: - With related children under 18 years: - Under 5 years and 5 to 17 years","Estimate; Income in the past 12 months below poverty level: - Other family: - Female householder, no husband present: - With related children under 18 years: - 5 to 17 years only","Margin of Error; Income in the past 12 months below poverty level: - Other family: - Female householder, no husband present: - With related children under 18 years: - 5 to 17 years only","Estimate; Income in the past 12 months below poverty level: - Other family: - Female householder, no husband present: - No related children under 18 years","Margin of Error; Income in the past 12 months below poverty level: - Other family: - Female householder, no husband present: - No related children under 18 years",Estimate; Income in the past 12 months at or above poverty level:,Margin of Error; Income in the past 12 months at or above poverty level:,Estimate; Income in the past 12 months at or above poverty level: - Married-couple family:,Margin of Error; Income in the past 12 months at or above poverty level: - Married-couple family:,Estimate; Income in the past 12 months at or above poverty level: - Married-couple family: - With related children under 18 years:,Margin of Error; Income in the past 12 months at or above poverty level: - Married-couple family: - With related children under 18 years:,Estimate; Income in the past 12 months at or above poverty level: - Married-couple family: - With related children under 18 years: - Under 5 years only,Margin of Error; Income in the past 12 months at or above poverty level: - Married-couple family: - With related children under 18 years: - Under 5 years only,Estimate; Income in the past 12 months at or above poverty level: - Married-couple family: - With related children under 18 years: - Under 5 years and 5 to 17 years,Margin of Error; Income in the past 12 months at or above poverty level: - Married-couple family: - With related children under 18 years: - Under 5 years and 5 to 17 years,Estimate; Income in the past 12 months at or above poverty level: - Married-couple family: - With related children under 18 years: - 5 to 17 years only,Margin of Error; Income in the past 12 months at or above poverty level: - Married-couple family: - With related children under 18 years: - 5 to 17 years only,Estimate; Income in the past 12 months at or above poverty level: - Married-couple family: - No related children under 18 years,Margin of Error; Income in the past 12 months at or above poverty level: - Married-couple family: - No related children under 18 years,Estimate; Income in the past 12 months at or above poverty level: - Other family:,Margin of Error; Income in the past 12 months at or above poverty level: - Other family:,"Estimate; Income in the past 12 months at or above poverty level: - Other family: - Male householder, no wife present:","Margin of Error; Income in the past 12 months at or above poverty level: - Other family: - Male householder, no wife present:","Estimate; Income in the past 12 months at or above poverty level: - Other family: - Male householder, no wife present: - With related children under 18 years:","Margin of Error; Income in the past 12 months at or above poverty level: - Other family: - Male householder, no wife present: - With related children under 18 years:","Estimate; Income in the past 12 months at or above poverty level: - Other family: - Male householder, no wife present: - With related children under 18 years: - Under 5 years only","Margin of Error; Income in the past 12 months at or above poverty level: - Other family: - Male householder, no wife present: - With related children under 18 years: - Under 5 years only","Estimate; Income in the past 12 months at or above poverty level: - Other family: - Male householder, no wife present: - With related children under 18 years: - Under 5 years and 5 to 17 years","Margin of Error; Income in the past 12 months at or above poverty level: - Other family: - Male householder, no wife present: - With related children under 18 years: - Under 5 years and 5 to 17 years","Estimate; Income in the past 12 months at or above poverty level: - Other family: - Male householder, no wife present: - With related children under 18 years: - 5 to 17 years only","Margin of Error; Income in the past 12 months at or above poverty level: - Other family: - Male householder, no wife present: - With related children under 18 years: - 5 to 17 years only","Estimate; Income in the past 12 months at or above poverty level: - Other family: - Male householder, no wife present: - No related children under 18 years","Margin of Error; Income in the past 12 months at or above poverty level: - Other family: - Male householder, no wife present: - No related children under 18 years","Estimate; Income in the past 12 months at or above poverty level: - Other family: - Female householder, no husband present:","Margin of Error; Income in the past 12 months at or above poverty level: - Other family: - Female householder, no husband present:","Estimate; Income in the past 12 months at or above poverty level: - Other family: - Female householder, no husband present: - With related children under 18 years:","Margin of Error; Income in the past 12 months at or above poverty level: - Other family: - Female householder, no husband present: - With related children under 18 years:","Estimate; Income in the past 12 months at or above poverty level: - Other family: - Female householder, no husband present: - With related children under 18 years: - Under 5 years only","Margin of Error; Income in the past 12 months at or above poverty level: - Other family: - Female householder, no husband present: - With related children under 18 years: - Under 5 years only","Estimate; Income in the past 12 months at or above poverty level: - Other family: - Female householder, no husband present: - With related children under 18 years: - Under 5 years and 5 to 17 years","Margin of Error; Income in the past 12 months at or above poverty level: - Other family: - Female householder, no husband present: - With related children under 18 years: - Under 5 years and 5 to 17 years","Estimate; Income in the past 12 months at or above poverty level: - Other family: - Female householder, no husband present: - With related children under 18 years: - 5 to 17 years only","Margin of Error; Income in the past 12 months at or above poverty level: - Other family: - Female householder, no husband present: - With related children under 18 years: - 5 to 17 years only","Estimate; Income in the past 12 months at or above poverty level: - Other family: - Female householder, no husband present: - No related children under 18 years","Margin of Error; Income in the past 12 months at or above poverty level: - Other family: - Female householder, no husband present: - No related children under 18 years"
0100000US,,United States,52519912,83134,3495934,29644,1474203,17344,803590,15003,164960,7546,253450,8220,385180,9243,670613,12058,2021731,22651,358371,8784,269337,7845,76426,4914,45620,3972,147291,4966,89034,4527,1663360,20895,1433821,20036,356529,10986,327650,9537,749642,15761,229539,7766,49023978,88766,40800010,97006,16041189,56166,3144541,29100,2893941,25551,10002707,42236,24758821,69216,8223968,46601,2597244,24449,1358608,19151,288330,9418,133288,6237,936990,15688,1238636,16464,5626724,37088,3098646,29309,479272,10815,317084,10249,2302290,26735,2528078,22884
0400000US37,37,North Carolina,1711574,13969,122580,5267,52315,3683,28425,2844,7049,1528,7491,1506,13885,2093,23890,2369,70265,4216,11668,1822,8928,1597,2759,1008,1459,710,4710,1013,2740,854,58597,3853,49890,3762,11852,1890,10015,1708,28023,3171,8707,1449,1588994,14286,1347894,12043,511940,9320,109286,5209,88818,3951,313836,6895,835954,9811,241100,8748,76653,5030,43124,4342,9358,1871,5227,1539,28539,3580,33529,3222,164447,7005,92101,5082,12742,2035,8621,1917,70738,4379,72346,4099
0500000US37067,37067,"Forsyth County, North Carolina",59843,2231,3598,1100,1041,600,688,508,530,460,0,287,158,183,353,267,2557,922,90,150,0,287,0,287,0,287,0,287,90,150,2467,921,2374,917,599,528,648,491,1127,680,93,110,56245,2256,47166,2228,18304,1663,4014,1074,3010,776,11280,1211,28862,1840,9079,1452,2629,802,1459,595,136,164,315,424,1008,496,1170,524,6450,1201,3751,898,463,427,418,333,2870,786,2699,712
0500000US37081,37081,"Guilford County, North Carolina",70717,2763,3323,966,1313,480,524,274,221,188,59,95,244,197,789,431,2010,823,576,386,397,350,0,287,128,152,269,387,179,170,1434,703,1378,702,376,301,375,412,627,463,56,93,67394,2746,56778,2489,22485,1760,4220,1063,4252,1027,14013,1510,34293,1893,10616,1781,3469,1113,1970,946,530,521,0,287,1440,744,1499,583,7147,1303,3870,1048,374,273,306,318,3190,913,3277,734
