GEO.id,GEO.id2,GEO.display-label,HD01_VD01,HD02_VD01,HD01_VD02,HD02_VD02,HD01_VD03,HD02_VD03,HD01_VD04,HD02_VD04,HD01_VD05,HD02_VD05,HD01_VD06,HD02_VD06,HD01_VD07,HD02_VD07,HD01_VD08,HD02_VD08,HD01_VD09,HD02_VD09,HD01_VD10,HD02_VD10,HD01_VD11,HD02_VD11,HD01_VD12,HD02_VD12,HD01_VD13,HD02_VD13,HD01_VD14,HD02_VD14,HD01_VD15,HD02_VD15,HD01_VD16,HD02_VD16,HD01_VD17,HD02_VD17,HD01_VD18,HD02_VD18,HD01_VD19,HD02_VD19,HD01_VD20,HD02_VD20,HD01_VD21,HD02_VD21,HD01_VD22,HD02_VD22,HD01_VD23,HD02_VD23,HD01_VD24,HD02_VD24,HD01_VD25,HD02_VD25,HD01_VD26,HD02_VD26,HD01_VD27,HD02_VD27,HD01_VD28,HD02_VD28,HD01_VD29,HD02_VD29,HD01_VD30,HD02_VD30,HD01_VD31,HD02_VD31,HD01_VD32,HD02_VD32,HD01_VD33,HD02_VD33,HD01_VD34,HD02_VD34,HD01_VD35,HD02_VD35,HD01_VD36,HD02_VD36,HD01_VD37,HD02_VD37,HD01_VD38,HD02_VD38,HD01_VD39,HD02_VD39,HD01_VD40,HD02_VD40,HD01_VD41,HD02_VD41
Id,Id2,Geography,Estimate; Total:,Margin of Error; Total:,Estimate; Income in the past 12 months below poverty level:,Margin of Error; Income in the past 12 months below poverty level:,Estimate; Income in the past 12 months below poverty level: - Married-couple family:,Margin of Error; Income in the past 12 months below poverty level: - Married-couple family:,Estimate; Income in the past 12 months below poverty level: - Married-couple family: - With related children of the householder under 18 years:,Margin of Error; Income in the past 12 months below poverty level: - Married-couple family: - With related children of the householder under 18 years:,Estimate; Income in the past 12 months below poverty level: - Married-couple family: - With related children of the householder under 18 years: - Under 5 years only,Margin of Error; Income in the past 12 months below poverty level: - Married-couple family: - With related children of the householder under 18 years: - Under 5 years only,Estimate; Income in the past 12 months below poverty level: - Married-couple family: - With related children of the householder under 18 years: - Under 5 years and 5 to 17 years,Margin of Error; Income in the past 12 months below poverty level: - Married-couple family: - With related children of the householder under 18 years: - Under 5 years and 5 to 17 years,Estimate; Income in the past 12 months below poverty level: - Married-couple family: - With related children of the householder under 18 years: - 5 to 17 years only,Margin of Error; Income in the past 12 months below poverty level: - Married-couple family: - With related children of the householder under 18 years: - 5 to 17 years only,Estimate; Income in the past 12 months below poverty level: - Married-couple family: - No related children of the householder under 18 years,Margin of Error; Income in the past 12 months below poverty level: - Married-couple family: - No related children of the householder under 18 years,Estimate; Income in the past 12 months below poverty level: - Other family:,Margin of Error; Income in the past 12 months below poverty level: - Other family:,"Estimate; Income in the past 12 months below poverty level: - Other family: - Male householder, no wife present:","Margin of Error; Income in the past 12 months below poverty level: - Other family: - Male householder, no wife present:","Estimate; Income in the past 12 months below poverty level: - Other family: - Male householder, no wife present: - With related children of the householder under 18 years:","Margin of Error; Income in the past 12 months below poverty level: - Other family: - Male householder, no wife present: - With related children of the householder under 18 years:","Estimate; Income in the past 12 months below poverty level: - Other family: - Male householder, no wife present: - With related children of the householder under 18 years: - Under 5 years only","Margin of Error; Income in the past 12 months below poverty level: - Other family: - Male householder, no wife present: - With related children of the householder under 18 years: - Under 5 years only","Estimate; Income in the past 12 months below poverty level: - Other family: - Male householder, no wife present: - With related children of the householder under 18 years: - Under 5 years and 5 to 17 years","Margin of Error; Income in the past 12 months below poverty level: - Other family: - Male householder, no wife present: - With related children of the householder under 18 years: - Under 5 years and 5 to 17 years","Estimate; Income in the past 12 months below poverty level: - Other family: - Male householder, no wife present: - With related children of the householder under 18 years: - 5 to 17 years only","Margin of Error; Income in the past 12 months below poverty level: - Other family: - Male householder, no wife present: - With related children of the householder under 18 years: - 5 to 17 years only","Estimate; Income in the past 12 months below poverty level: - Other family: - Male householder, no wife present: - No related children of the householder under 18 years","Margin of Error; Income in the past 12 months below poverty level: - Other family: - Male householder, no wife present: - No related children of the householder under 18 years","Estimate; Income in the past 12 months below poverty level: - Other family: - Female householder, no husband present:","Margin of Error; Income in the past 12 months below poverty level: - Other family: - Female householder, no husband present:","Estimate; Income in the past 12 months below poverty level: - Other family: - Female householder, no husband present: - With related children of the householder under 18 years:","Margin of Error; Income in the past 12 months below poverty level: - Other family: - Female householder, no husband present: - With related children of the householder under 18 years:","Estimate; Income in the past 12 months below poverty level: - Other family: - Female householder, no husband present: - With related children of the householder under 18 years: - Under 5 years only","Margin of Error; Income in the past 12 months below poverty level: - Other family: - Female householder, no husband present: - With related children of the householder under 18 years: - Under 5 years only","Estimate; Income in the past 12 months below poverty level: - Other family: - Female householder, no husband present: - With related children of the householder under 18 years: - Under 5 years and 5 to 17 years","Margin of Error; Income in the past 12 months below poverty level: - Other family: - Female householder, no husband present: - With related children of the householder under 18 years: - Under 5 years and 5 to 17 years","Estimate; Income in the past 12 months below poverty level: - Other family: - Female householder, no husband present: - With related children of the householder under 18 years: - 5 to 17 years only","Margin of Error; Income in the past 12 months below poverty level: - Other family: - Female householder, no husband present: - With related children of the householder under 18 years: - 5 to 17 years only","Estimate; Income in the past 12 months below poverty level: - Other family: - Female householder, no husband present: - No related children of the householder under 18 years","Margin of Error; Income in the past 12 months below poverty level: - Other family: - Female householder, no husband present: - No related children of the householder under 18 years",Estimate; Income in the past 12 months at or above poverty level:,Margin of Error; Income in the past 12 months at or above poverty level:,Estimate; Income in the past 12 months at or above poverty level: - Married-couple family:,Margin of Error; Income in the past 12 months at or above poverty level: - Married-couple family:,Estimate; Income in the past 12 months at or above poverty level: - Married-couple family: - With related children of the householder under 18 years:,Margin of Error; Income in the past 12 months at or above poverty level: - Married-couple family: - With related children of the householder under 18 years:,Estimate; Income in the past 12 months at or above poverty level: - Married-couple family: - With related children of the householder under 18 years: - Under 5 years only,Margin of Error; Income in the past 12 months at or above poverty level: - Married-couple family: - With related children of the householder under 18 years: - Under 5 years only,Estimate; Income in the past 12 months at or above poverty level: - Married-couple family: - With related children of the householder under 18 years: - Under 5 years and 5 to 17 years,Margin of Error; Income in the past 12 months at or above poverty level: - Married-couple family: - With related children of the householder under 18 years: - Under 5 years and 5 to 17 years,Estimate; Income in the past 12 months at or above poverty level: - Married-couple family: - With related children of the householder under 18 years: - 5 to 17 years only,Margin of Error; Income in the past 12 months at or above poverty level: - Married-couple family: - With related children of the householder under 18 years: - 5 to 17 years only,Estimate; Income in the past 12 months at or above poverty level: - Married-couple family: - No related children of the householder under 18 years,Margin of Error; Income in the past 12 months at or above poverty level: - Married-couple family: - No related children of the householder under 18 years,Estimate; Income in the past 12 months at or above poverty level: - Other family:,Margin of Error; Income in the past 12 months at or above poverty level: - Other family:,"Estimate; Income in the past 12 months at or above poverty level: - Other family: - Male householder, no wife present:","Margin of Error; Income in the past 12 months at or above poverty level: - Other family: - Male householder, no wife present:","Estimate; Income in the past 12 months at or above poverty level: - Other family: - Male householder, no wife present: - With related children of the householder under 18 years:","Margin of Error; Income in the past 12 months at or above poverty level: - Other family: - Male householder, no wife present: - With related children of the householder under 18 years:","Estimate; Income in the past 12 months at or above poverty level: - Other family: - Male householder, no wife present: - With related children of the householder under 18 years: - Under 5 years only","Margin of Error; Income in the past 12 months at or above poverty level: - Other family: - Male householder, no wife present: - With related children of the householder under 18 years: - Under 5 years only","Estimate; Income in the past 12 months at or above poverty level: - Other family: - Male householder, no wife present: - With related children of the householder under 18 years: - Under 5 years and 5 to 17 years","Margin of Error; Income in the past 12 months at or above poverty level: - Other family: - Male householder, no wife present: - With related children of the householder under 18 years: - Under 5 years and 5 to 17 years","Estimate; Income in the past 12 months at or above poverty level: - Other family: - Male householder, no wife present: - With related children of the householder under 18 years: - 5 to 17 years only","Margin of Error; Income in the past 12 months at or above poverty level: - Other family: - Male householder, no wife present: - With related children of the householder under 18 years: - 5 to 17 years only","Estimate; Income in the past 12 months at or above poverty level: - Other family: - Male householder, no wife present: - No related children of the householder under 18 years","Margin of Error; Income in the past 12 months at or above poverty level: - Other family: - Male householder, no wife present: - No related children of the householder under 18 years","Estimate; Income in the past 12 months at or above poverty level: - Other family: - Female householder, no husband present:","Margin of Error; Income in the past 12 months at or above poverty level: - Other family: - Female householder, no husband present:","Estimate; Income in the past 12 months at or above poverty level: - Other family: - Female householder, no husband present: - With related children of the householder under 18 years:","Margin of Error; Income in the past 12 months at or above poverty level: - Other family: - Female householder, no husband present: - With related children of the householder under 18 years:","Estimate; Income in the past 12 months at or above poverty level: - Other family: - Female householder, no husband present: - With related children of the householder under 18 years: - Under 5 years only","Margin of Error; Income in the past 12 months at or above poverty level: - Other family: - Female householder, no husband present: - With related children of the householder under 18 years: - Under 5 years only","Estimate; Income in the past 12 months at or above poverty level: - Other family: - Female householder, no husband present: - With related children of the householder under 18 years: - Under 5 years and 5 to 17 years","Margin of Error; Income in the past 12 months at or above poverty level: - Other family: - Female householder, no husband present: - With related children of the householder under 18 years: - Under 5 years and 5 to 17 years","Estimate; Income in the past 12 months at or above poverty level: - Other family: - Female householder, no husband present: - With related children of the householder under 18 years: - 5 to 17 years only","Margin of Error; Income in the past 12 months at or above poverty level: - Other family: - Female householder, no husband present: - With related children of the householder under 18 years: - 5 to 17 years only","Estimate; Income in the past 12 months at or above poverty level: - Other family: - Female householder, no husband present: - No related children of the householder under 18 years","Margin of Error; Income in the past 12 months at or above poverty level: - Other family: - Female householder, no husband present: - No related children of the householder under 18 years"
0100000US,,United States,78631163,144258,7501125,49657,2784132,29145,1577589,19846,221781,7866,557697,12196,798111,15454,1206543,16154,4716993,38292,808519,16591,585524,14282,125506,6594,137290,6223,322728,11813,222995,8664,3908474,32085,3320799,29491,577934,12882,919575,18135,1823290,23098,587675,10916,71130038,146307,55063442,163570,22383071,76901,4160536,33221,4329757,34252,13892778,58972,32680371,111980,16066596,65579,5078142,39114,2618305,28791,547953,14981,353938,10849,1716414,20829,2459837,28796,10988454,52004,5981527,38529,859957,15543,794178,16336,4327392,35232,5006927,36774
0400000US37,37,North Carolina,2590180,17902,275466,8835,99685,5368,56751,4432,7793,1681,19451,2655,29507,3214,42934,3191,175781,7525,32371,3429,24075,2849,4512,1142,7926,1643,11637,1989,8296,1596,143410,6855,124391,6551,24041,3401,34149,3425,66201,4248,19019,2251,2314714,18204,1807974,19448,706016,14431,136635,6703,125285,5939,444096,11827,1101958,13673,506740,12655,146479,6480,80022,5172,17083,2586,10527,1788,52412,3895,66457,4409,360261,10365,200299,8591,28093,2531,24873,2894,147333,8360,159962,6369
0500000US37063,37063,"Durham County, North Carolina",74176,3386,9046,1729,2470,946,1858,810,36,63,625,465,1197,693,612,436,6576,1494,741,559,579,551,0,207,480,538,99,119,162,156,5835,1358,5204,1373,791,603,1724,1019,2689,1190,631,346,65130,3326,48168,3062,19750,2230,6531,1355,3557,1065,9662,1696,28418,2486,16962,2435,3983,1096,2061,878,759,558,268,243,1034,591,1922,773,12979,2216,7666,1908,1676,892,804,444,5186,1546,5313,1055
0500000US37067,37067,"Forsyth County, North Carolina",89076,3309,11582,1620,4315,1009,2407,764,429,332,822,502,1156,571,1908,712,7267,1370,1648,682,1576,680,79,92,659,475,838,573,72,87,5619,1126,5152,1127,1024,586,1304,527,2824,830,467,286,77494,3474,59850,3233,23522,2143,3981,1122,4639,1205,14902,1562,36328,2472,17644,2153,4893,1302,3039,1161,304,265,387,353,2348,967,1854,620,12751,1924,6996,1623,1344,674,642,431,5010,1238,5755,1032
0500000US37081,37081,"Guilford County, North Carolina",126983,4670,13631,2122,5061,1095,2703,827,401,376,1340,708,962,477,2358,819,8570,1806,1031,602,769,547,94,129,0,207,675,537,262,245,7539,1618,6777,1616,1366,868,1280,656,4131,1236,762,384,113352,4218,83705,3804,34073,2797,5939,1387,6163,1277,21971,2411,49632,2706,29647,2627,8135,1628,4633,1223,844,708,405,405,3384,1138,3502,1183,21512,2180,12944,2213,1482,660,1910,880,9552,1995,8568,1323
